manufacturer,model,canonical_id,official_product_url,existing_primary_family,existing_design_subtype,proposed_primary_category,secondary_categories,fin_configuration,wave_power,wave_types,ability_range,paddle_profile,performance_profile,recommendation_lanes,excluded_lanes,source_summary,manufacturer_evidence,rocker_notes,rail_notes,tail_notes,key_trade_offs,source_confidence,classification_confidence,classification_status,changed_from_current,change_reason,review_decision,review_notes
Pyzel,Phantom Squash,7798,https://pyzelsurf.com.au/products/phantom,Hybrid Shortboard,All Round Daily Driver,hybrid_shortboard,daily_driver,Thruster | Five Fin,powerful,,Progressing | Intermediate | Advanced,moderate_high,moderate,hybrid_shortboard | daily_driver | forgiving_shortboard,alternative | beginner | big_wave | competition | everyday | fish | flow | good_wave | groveller | gun | hollow_wave | longboard | mid_length | paddle_support | performance_daily_driver | performance_fish | performance_mid_length | performance_shortboard | performance_twin | point_break | powerful_wave | small_wave | small_wave_shortboard | softboard | step_up | traditional_fish | twin_pin | weak_wave,Mapped from canonical taxonomy daily_driver.,"Pyzel's Phantom Squash is a Step-down version of John John Florences current favorite model, the Ghost. The Phantom is best in waist-high to slightly overhead waves of all types. It's your daily driver with a high-performance edge! When the Ghost was first released we had no idea that its unique design would come to be embraced by so many people in so many different types of waves. We kept hearing that it worked best in waves shoulder-high and up. Taking this feedback we made a step-down board that would bring that same feel to the head-high and under days that make up most of our daily surf sessions. The Phantom is a squashed down version of the Ghost, souped up, with added volume, great for your everyday sessions in less than epic conditions. We left the same Ghost rocker but added more single concave to flatten it out through the center, which helps to create speed and flow without taking away from the overall performance or feel of the original design. We added width in the tail and nose to create a more parallel, fuller outline that helps you maintain speed through slower sections and tight turns. The rails are full but not chunky, giving you more floatation and speed without taking away the sensitivity that we all love in our boards.","We left the same Ghost rocker but added more single concave to flatten it out through the center, which helps to create speed and flow without taking away from the overall performance or feel of the original design. The rails are full but not chunky, giving you more floatation and speed without taking away the sensitivity that we all love in our boards.",,"Pyzel's Phantom Squash is a Step-down version of John John Florences current favorite model, the Ghost. The Phantom is a squashed down version of the Ghost, souped up, with added volume, great for your everyday sessions in less than epic conditions.",,medium,high,proposed_for_owner_review,False,current primaryFamily=Hybrid Shortboard; \bhybrid shortboard\b,,
Pyzel,Phantom XL,7773,https://pyzelsurf.com.au/products/phantom-xl-electralite-eps,Performance Daily Driver,Performance Daily Driver,performance_daily_driver,daily_driver,Thruster,moderate,,Intermediate | Advanced,moderate,high_everyday,performance_daily_driver | daily_driver | performance_shortboard,alternative | beginner | big_wave | competition | everyday | fish | flow | forgiving_shortboard | good_wave | groveller | gun | hollow_wave | hybrid_shortboard | longboard | mid_length | paddle_support | performance_fish | performance_mid_length | performance_twin | point_break | powerful_wave | small_wave | small_wave_shortboard | softboard | step_up | traditional_fish | twin_pin | weak_wave,Curated Phantom XL classification for riders needing more support than the standard Phantom.,"Pyzel lists the Phantom XL as the higher-support variant of the Phantom daily-driver family. Quivrr's governed classification records added width and support over the standard Phantom, with a trade-off in responsiveness for lighter or fitter surfers who already fit the standard model naturally.",,,,Adds support and width over the standard Phantom | Can blunt responsiveness for lighter or fitter surfers,high,high,proposed_for_owner_review,False,current primaryFamily=Performance Daily Driver; \bperformance daily driver\b,,
Pyzel,Power Tiger,7769,https://pyzelsurf.com.au/products/power-tiger,Hybrid Shortboard,All Round Daily Driver,hybrid_shortboard,daily_driver,Thruster | Five Fin,powerful,,Progressing | Intermediate | Advanced,moderate_high,moderate,hybrid_shortboard | daily_driver | forgiving_shortboard,alternative | beginner | big_wave | competition | everyday | fish | flow | good_wave | groveller | gun | hollow_wave | longboard | mid_length | paddle_support | performance_daily_driver | performance_fish | performance_mid_length | performance_shortboard | performance_twin | point_break | powerful_wave | small_wave | small_wave_shortboard | softboard | step_up | traditional_fish | twin_pin | weak_wave,Mapped from canonical taxonomy hybrid.,"Early this winter John John Florence came to me asking for a board that would fit in between the Red Tiger and his Ghost as far as wave size and quality goes. John had already helped me to develop the Red Tiger for performance surfing in smaller and weaker types of waves and we have all seen his amazing surfing on that board. The short story here is that the new Power Tiger is a refined version of the Red Tiger with design changes made to help handle bigger, better, more powerful waves. The Red Tiger is still John’s go-to for slower waves in the head-high and below range, but the Power Tiger fits in perfectly once the surf gets a little bigger, especially when it gets more powerful (thus the name). The main and most obvious difference is in the outline. We pulled in both the nose and the tail which creates more curve in the whole outline which has a huge effect on the way the Power TIger surfs. The narrower tail will hold better at speed while being pushed hard through turns (no sliding out off the bottom), and the extra curve through the tail adds looseness in tighter pockets. The pulled-in nose also allows the board to fit into the curve on hollow, more “cupped out” types of waves without getting caught up. The overall added outline curve makes the board easier to throw up into the lip at speed and keeps it ultra-responsive. Another subtle but important change we made is that","Another subtle but important change we made is that we thinned out the rails on the Power Tiger, which helps let you sink your rail on speedier, more powerful waves without having to worry about too much pushback. The thinner rails also help in knifing into barrels and holding through big carves.",,"We pulled in both the nose and the tail which creates more curve in the whole outline which has a huge effect on the way the Power TIger surfs. The narrower tail will hold better at speed while being pushed hard through turns (no sliding out off the bottom), and the extra curve through the tail adds looseness in tighter pockets.",,low,high,proposed_for_owner_review,False,current primaryFamily=Hybrid Shortboard; \bhybrid shortboard\b,,
Pyzel,Power Tiger Grom,7765,https://pyzelsurf.com.au/products/power-tiger-grom-with-pink-spray,Alternative Performance,Alternative Performance,step_up,performance_twin,Twin | Quad,powerful,,Intermediate | Advanced | Expert,moderate,high_powerful_wave,step_up | powerful_wave | hollow_wave,alternative | beginner | big_wave | competition | daily_driver | everyday | fish | flow | forgiving_shortboard | good_wave | groveller | gun | hybrid_shortboard | longboard | mid_length | paddle_support | performance_daily_driver | performance_fish | performance_mid_length | performance_shortboard | performance_twin | point_break | small_wave | small_wave_shortboard | softboard | traditional_fish | twin_pin | weak_wave,Mapped from canonical taxonomy youth.,"The Power Tiger is now available in grom sizes. The Power Tiger surfboard is the latest innovation from Pyzel, developed in collaboration with John John Florence. Designed to bridge the gap between the Red Tiger and the Ghost, the Power Tiger is tailored to handle bigger, more powerful waves while maintaining exceptional performance. The Pyzel Power Tiger features; Refined Outline: The Power Tiger features a pulled-in nose and tail, creating more curve in the outline. This adjustment enhances the board's ability to handle speed and tight turns, making it ultra-responsive in more powerful surf. Enhanced Tail Design: The narrower tail holds better at speed and through turns, preventing sliding out off the bottom. The extra curve through the tail adds looseness in tighter pockets. Pulled-in Nose: The refined nose design allows the board to fit seamlessly into hollow, cupped-out waves without catching, providing smooth transitions and control. Thinner Rails: Thinned-out rails improve the board's ability to sink in speedier, more powerful waves, aiding in carving and barrels without pushback. Adjustments in Rocker: An additional 1/8"" of curve through the last 18"" in the tail loosens up the board, enhances rail transitions at speed, and boosts holding ability through turns. The Power Tiger excels when the waves start to get bigger and more powerful, offering a perfect transition from","Thinner Rails: Thinned-out rails improve the board's ability to sink in speedier, more powerful waves, aiding in carving and barrels without pushback. Adjustments in Rocker: An additional 1/8"" of curve through the last 18"" in the tail loosens up the board, enhances rail transitions at speed, and boosts holding ability through turns.",,"Designed to bridge the gap between the Red Tiger and the Ghost, the Power Tiger is tailored to handle bigger, more powerful waves while maintaining exceptional performance. The Pyzel Power Tiger features; Refined Outline: The Power Tiger features a pulled-in nose and tail, creating more curve in the outline.",,medium,high,proposed_for_owner_review,True,\bpowerful surf\b,,
Pyzel,Power Tiger XL,7767,https://pyzelsurf.com.au/products/power-tiger-xl,Groveller,Small Wave Performance,performance_shortboard,groveller,Thruster | Five Fin,weak,,Intermediate | Advanced,low_moderate,very_high,performance_shortboard | good_wave | competition,alternative | beginner | big_wave | daily_driver | everyday | fish | flow | forgiving_shortboard | groveller | gun | hollow_wave | hybrid_shortboard | longboard | mid_length | paddle_support | performance_daily_driver | performance_fish | performance_mid_length | performance_twin | point_break | powerful_wave | small_wave | small_wave_shortboard | softboard | step_up | traditional_fish | twin_pin | weak_wave,Mapped from canonical taxonomy groveller.,"Silky smooth, even in junk waves, and possibly our fastest board yet, The Red Tiger is John John Florence’s new High Performance Shortboard unlike anything we have released in the past. It is the ultimate performance machine for medium sized, slower, weaker waves, based on John’s simple guidance - make it Fast and Fun. The idea for this board was hatched when John began riding some different ""fun"" boards during some breaks from competing. By far his favorite in the last year has been our new flat rockered, Funformance board, the White Tiger (5'6’""), and he asked me to turn that design into something he could take back on tour to ride when the surf was less than pumping, or on the weaker side. The outline is a touch on the plump side for a HPSB, but the wide point sits a more traditional inch behind center, keeping the emphasis to surfing it off the mid to back half of the board. The wider tail-block squash helps to keep area in the tail which provides lift and drive, and also helps create ""pop"" when going to the air. A moderate hip by the front fins puts a break in the outline to help create a pivot point that allows for tighter radius turns and release in the lip. The rocker and bottom contour is really what sets this board from other boards in this category. It’s our flattest HPSB so far and that rocker translates to easy, consistent speed from the moment you stand up, throug","By far his favorite in the last year has been our new flat rockered, Funformance board, the White Tiger (5'6’""), and he asked me to turn that design into something he could take back on tour to ride when the surf was less than pumping, or on the weaker side. The rocker and bottom contour is really what sets this board from other boards in this category.",,"By far his favorite in the last year has been our new flat rockered, Funformance board, the White Tiger (5'6’""), and he asked me to turn that design into something he could take back on tour to ride when the surf was less than pumping, or on the weaker side. The outline is a touch on the plump side for a HPSB, but the wide point sits a more traditional inch ",,medium,high,proposed_for_owner_review,True,\bhigh performance shortboard\b; \bperformance shortboard\b; \bhpsb\b,,
Pyzel,Precious,7776,https://pyzelsurf.com.au/products/precious,Hybrid Shortboard,All Round Daily Driver,daily_driver,hybrid_shortboard,Thruster | Five Fin,weak,,Progressing | Intermediate | Advanced,moderate,moderate,daily_driver | everyday,alternative | beginner | big_wave | competition | fish | flow | forgiving_shortboard | good_wave | groveller | gun | hollow_wave | hybrid_shortboard | longboard | mid_length | paddle_support | performance_daily_driver | performance_fish | performance_mid_length | performance_shortboard | performance_twin | point_break | powerful_wave | small_wave | small_wave_shortboard | softboard | step_up | traditional_fish | twin_pin | weak_wave,Mapped from canonical taxonomy daily_driver.,"Pyzel Surfboards is happy to announce the release of the 3rd addition to their Velocity Project series, the Precious, in collaboration with Jai Glindeman. The Precious model is an easy paddler board that gets up and goes fast and still has a snappy, drivey, high-performance feel to get you the most out of every kind of wave from 1-6ft. The Precious came about when a friend asked Jon for a one-board quiver that he could take around the world and have a good surf on. “One board to rule them all” was the call and thus the name Precious came about (Lord of the Rings nerds will get this, everyone else just don’t worry about it). ""I based it off of the Gremlin since that board is so versatile and fun, but we wanted it to be sleeker, more towards a performance feel with less width and less chunky rails. To do that, and still keep a fair bit of volume in the board, we decided to make it a step-deck. This allowed us to keep some foam in the overall board, but let it have a sensitive, high-performance rail simultaneously. When creating the step-deck it also makes the deck concave, which adds stability and more sensitivity to the design, and it seems to give you a little extra boost of paddle power as a side benefit."" - Jon Pyzel The Pyzel Precious has; A step deck, adding stability, sensitivity and extra paddling power. A flatter entry rocker and subtle curve through the tail for easy ac",flatter entry rocker,,"A flatter entry rocker and subtle curve through the tail for easy acceleration, speed and quick, responsive turning. An ample V running of the wide tailblock that lets it tip onto its rail with ease.",,medium,medium,proposed_for_owner_review,True,\bdaily driver\b; \bone-board quiver\b,,
Pyzel,Puerto Padi,7777,https://pyzelsurf.com.au/products/puerto-padi,Semi Gun,Travel Step Up,step_up,,Thruster,powerful,reef_break,Advanced | Expert,moderate,high_powerful_wave,step_up | powerful_wave | hollow_wave,alternative | beginner | big_wave | competition | daily_driver | everyday | fish | flow | forgiving_shortboard | good_wave | groveller | gun | hybrid_shortboard | longboard | mid_length | paddle_support | performance_daily_driver | performance_fish | performance_mid_length | performance_shortboard | performance_twin | point_break | small_wave | small_wave_shortboard | softboard | traditional_fish | twin_pin | weak_wave,Mapped from canonical taxonomy gun.,"The Puerto Padi came about when both Nathan Florence and Billy Kemper asked me to re-design their favourite Padillacs to better suit the late drops and tricky barrels of Puerto Escondido. The Padillac has proven to be one of the best big wave designs of the past decade, but they wanted something that would let them take off later and deeper, and be able to knife under the lip even easier, so I made some small yet significant changes. These changes have worked out well enough that Nathan has ridden his Puerto Padis on 2 waves that are considered to be at the top of the list of the very best tube/foamball rides in surfing history- both in Ireland– his 7’5’’ on the crazy left at Mullaghmore and his psycho backdoor of the right at Aileens. The team also loves them in long, hollow reef breaks like Cloudbreak. The biggest design changes are mostly evident in the front half of the board. To help the board to fit into stepper drops and thread-deep barrels we narrowed the nose width by ½ an inch, added extra nose rocker and also thinned out the nose by close to ¼ inch. These changes help to free up the whole front end of the board in more critical situations and add sensitivity while still packing a lot of paddle power into a board for its size. The Puerto Padi also features a pulled-in baby swallow tail which increases reaction time off the bottom enough to allow for fast adjustments u","To help the board to fit into stepper drops and thread-deep barrels we narrowed the nose width by ½ an inch, added extra nose rocker and also thinned out the nose by close to ¼ inch.",,swallow tail,,medium,high,proposed_for_owner_review,True,\bstep[ -]?up\b; \bsemi[ -]?gun\b,,
Pyzel,Pyzalien,7799,https://pyzelsurf.com.au/products/pyzalien,Hybrid Shortboard,All Round Daily Driver,daily_driver,hybrid_shortboard,Thruster | Five Fin,moderate,,Progressing | Intermediate | Advanced,moderate,moderate,daily_driver | everyday,alternative | beginner | big_wave | competition | fish | flow | forgiving_shortboard | good_wave | groveller | gun | hollow_wave | hybrid_shortboard | longboard | mid_length | paddle_support | performance_daily_driver | performance_fish | performance_mid_length | performance_shortboard | performance_twin | point_break | powerful_wave | small_wave | small_wave_shortboard | softboard | step_up | traditional_fish | twin_pin | weak_wave,Mapped from canonical taxonomy daily_driver.,"Pyzel's PyzAlien is one of the most popular models in the range giving you the feel of a high-performance board disguised as a stubby. Designed as an all-rounder this board has a shorter fatter outline combined with a lower entry rocker and high tail rocker.This ensures the Pyzalien is fast and easy to paddle while still being loose on the backfoot giving you the ability to perform tight turns in the pocket of the wave. Tail Shape: Round Squash Tail Concave Rails: Full Rail Fin System: FCS, Futures Fin Setup: Thruster, Quad, Five Fin",lower entry rocker,Full Rail,Squash Tail,,low,medium,proposed_for_owner_review,True,\bdaily driver\b; \ball[ -]?rounder\b,,
Pyzel,Pyzalien 2,7789,https://pyzelsurf.com.au/products/pyzalien2electraliteepoxy,Performance Daily Driver,Performance Daily Driver,performance_daily_driver,daily_driver,Thruster | Five Fin,weak,,Intermediate | Advanced,moderate,high_everyday,performance_daily_driver | daily_driver | performance_shortboard,alternative | beginner | big_wave | competition | everyday | fish | flow | forgiving_shortboard | good_wave | groveller | gun | hollow_wave | hybrid_shortboard | longboard | mid_length | paddle_support | performance_fish | performance_mid_length | performance_twin | point_break | powerful_wave | small_wave | small_wave_shortboard | softboard | step_up | traditional_fish | twin_pin | weak_wave,Curated performance daily-driver classification.,"An amazing option for the One Board Quiver - Pyzel's Pyzalien 2 is a fresh take on an older favourite! For years the original Pyzalien has been an all-time favourite model, so we decided to take a fresh approach to it and release the new and improved Pyzalien 2 for 2020. Back when the Original came out it was a lot different than the shortboards of the time- wide point forward outline, wider overall in the nose, with the thickness flow pushed forward as well. It was designed to be ridden shorter/wider than your normal boards, but still have the volume needed to make it work well in weaker waves. 10+ years later and the Pyzalien still looks a little different, but most modern shortboard designs have shifted in a similar direction. The Pyzalien 2 works great in a huge variety of waves, from points to reefs to beach break, and has one of the most user-friendly, yet high performance rockers we've made, smooth and clean, with med/low entry running through to med+ tail rocker. The bottom has a single concave starting in the nose, running under the front foot, blending into double concave and then VEE in the last 6 inches of the tail which adds release that helps ease you into turns. This rocker/bottom combo gives the board quick, effortless speed from take-off, while increasing the responsiveness and control, allowing for easier rail to rail transitions at high speeds. The outline is","The Pyzalien 2 works great in a huge variety of waves, from points to reefs to beach break, and has one of the most user-friendly, yet high performance rockers we've made, smooth and clean, with med/low entry running through to med+ tail rocker. This rocker/bottom combo gives the board quick, effortless speed from take-off, while increasing the responsivenes",refined rails,swallow tail,,medium,high,proposed_for_owner_review,False,current primaryFamily=Performance Daily Driver; \bperformance daily driver\b,,
Pyzel,Pyzalien 2 XL,7784,https://pyzelsurf.com.au/products/pyzalien-2-xl-electralite,Performance Daily Driver,Performance Daily Driver,performance_daily_driver,daily_driver,Thruster | Five Fin,weak,beach_break,Intermediate | Advanced,moderate,high_everyday,performance_daily_driver | daily_driver | performance_shortboard,alternative | beginner | big_wave | competition | everyday | fish | flow | forgiving_shortboard | good_wave | groveller | gun | hollow_wave | hybrid_shortboard | longboard | mid_length | paddle_support | performance_fish | performance_mid_length | performance_twin | point_break | powerful_wave | small_wave | small_wave_shortboard | softboard | step_up | traditional_fish | twin_pin | weak_wave,Mapped from canonical taxonomy daily_driver.,"The Pyzalien 2 XL is an amazing option for the One Board Quiver! A fresh take on an all time favorite design offered in fuller dimensions to suit the larger size surfer, or just if you are looking for a higher volume version. For years the original Pyzalien has been an all-time favourite model, so we decided to take a fresh approach to it and release the new and improved Pyzalien 2 for 2020. Back when the Original came out it was a lot different than the shortboards of the time- wide point forward outline, wider overall in the nose, with the thickness flow pushed forward as well. It was designed to be ridden shorter/wider than your normal boards, but still have the volume needed to make it work well in weaker waves. 10+ years later and the Pyzalien still looks a little different, but most modern shortboard designs have shifted in a similar direction. The Pyzalien 2 works great in a huge variety of waves, from points to reefs to beach break, and has one of the most user friendly, yet high performance rockers we've made, smooth and clean, with med/low entry running through to med+ tail rocker. The bottom has a single concave starting in the nose, running under the front foot, blending into double concave and then VEE in the last 6 inches of the tail which adds release that helps ease you into turns. This rocker/bottom combo gives the board quick, effortless speed from take-off, w","The Pyzalien 2 works great in a huge variety of waves, from points to reefs to beach break, and has one of the most user friendly, yet high performance rockers we've made, smooth and clean, with med/low entry running through to med+ tail rocker. This rocker/bottom combo gives the board quick, effortless speed from take-off, while increasing the responsivenes",refined rails,swallow tail,,medium,high,proposed_for_owner_review,False,current primaryFamily=Performance Daily Driver; \bperformance daily driver\b,,
