manufacturer,model,canonical_id,official_product_url,existing_primary_family,existing_design_subtype,proposed_primary_category,secondary_categories,fin_configuration,wave_power,wave_types,ability_range,paddle_profile,performance_profile,recommendation_lanes,excluded_lanes,source_summary,manufacturer_evidence,rocker_notes,rail_notes,tail_notes,key_trade_offs,source_confidence,classification_confidence,classification_status,changed_from_current,change_reason,review_decision,review_notes
Pyzel,Happy Twin,7771,https://pyzelsurf.com.au/products/happytwin,Groveller,Small Wave Performance,groveller,,Thruster | Five Fin,weak,,Intermediate | Advanced,high,moderate_small_wave,groveller | small_wave | weak_wave,alternative | beginner | big_wave | competition | daily_driver | everyday | fish | flow | forgiving_shortboard | good_wave | gun | hollow_wave | hybrid_shortboard | longboard | mid_length | paddle_support | performance_daily_driver | performance_fish | performance_mid_length | performance_shortboard | performance_twin | point_break | powerful_wave | small_wave_shortboard | softboard | step_up | traditional_fish | twin_pin,Mapped from canonical taxonomy groveller.,"The Happy Twin is a modern take on the classic winged swallow twin fin. We have designed it for down the line speed and lightning fast turns, easy paddling and maximum fun.The Happy Twin features a full outline, with a wide point forward, including a single wing right behind the front fins to create a pivot point for snappy turns and plenty of bite.A flatter rocker ensures easy speed and a tonne of glide in weaker, slower surf. The bottom design uses a double concave within a single, blending into a pronounced Vee off the tail for smoother, more seamless rail to rail transitions.The deck has a special, inset double concave shaped into the chest/front foot area that gives it that already ""broken in"" comfortable feeling on your very first surf. it also features an old school ""beak"" nose.A rear fin box (or plug) allows for the use of a stabilizer to add some drive without taking away from the overall feeling of the twins.The Happy Twin is a great addition to your quiver not only smaller surf, but also for a unique fast and free experience in more favorable conditions at nearly all wave types worldwide.We recommend ordering your height or slightly under, around 1"" wider and a touch thicker than your shortboard for a slightly increased overall volume and glide.","We have designed it for down the line speed and lightning fast turns, easy paddling and maximum fun.The Happy Twin features a full outline, with a wide point forward, including a single wing right behind the front fins to create a pivot point for snappy turns and plenty of bite.A flatter rocker ensures easy speed and a tonne of glide in weaker, slower surf. ",,"The Happy Twin is a modern take on the classic winged swallow twin fin. The bottom design uses a double concave within a single, blending into a pronounced Vee off the tail for smoother, more seamless rail to rail transitions.The deck has a special, inset double concave shaped into the chest/front foot area that gives it that already ""broken in"" comfortable ",,medium,high,proposed_for_owner_review,False,current primaryFamily=Groveller; \bgrovell?er\b,,
Pyzel,Highline,7788,https://pyzelsurf.com.au/products/highline,High Performance Shortboard,Competition HPSB,performance_shortboard,,Thruster,moderate,,Advanced | Expert,low_moderate,very_high,performance_shortboard | good_wave | competition,alternative | beginner | big_wave | daily_driver | everyday | fish | flow | forgiving_shortboard | groveller | gun | hollow_wave | hybrid_shortboard | longboard | mid_length | paddle_support | performance_daily_driver | performance_fish | performance_mid_length | performance_twin | point_break | powerful_wave | small_wave | small_wave_shortboard | softboard | step_up | traditional_fish | twin_pin | weak_wave,Mapped from canonical taxonomy performance_shortboard.,"The Pyzel Highline is the surfboard you want handy for maximizing your performance, even when the waves are less than perfect. Designed to excel in average-to-good waves, and based on the popular Pyzel 74 model (Dane Reynolds's choice for Stab in the Dark). The Pyzel Highline features: The bottom rocker is medium/high, which generates speed and drive, but still allows the board to be loose and responsive. It has a single concave all the way through. This combination of contours and curves generates lift for quick acceleration, holding speed, and drive. The outline wide point is just back from the centre and it has a pronounced hip that adds drive while creating a pivot point that allows for snappy, vertical surfing. The deck is slightly flatter than other Pyzel boards, with more volume pushed out towards the rail. The rail is refined, not boxy, keeping it sensitive and easy to push through turns. To put it simply the Pyzel Highline is a great high-performance surfboard for good to below-average waves. It will help you make the most of your everyday surfs and elevate your surfing performance. We recommend you ride it at anywhere from an inch under to an inch over your height and at your favourite performance surfboard dims and volume.","The Pyzel Highline features: The bottom rocker is medium/high, which generates speed and drive, but still allows the board to be loose and responsive. The deck is slightly flatter than other Pyzel boards, with more volume pushed out towards the rail.",,"The rail is refined, not boxy, keeping it sensitive and easy to push through turns.",,medium,high,proposed_for_owner_review,False,current primaryFamily=High Performance Shortboard; \bhigh performance shortboard\b; \bperformance shortboard\b; \bhpsb\b,,
Pyzel,Mid Length Crisis,7790,https://pyzelsurf.com.au/products/mid-length-crisis,Mid Length,Mid Length,mid_length,,Single | Two Plus One | Twin,weak,,Progressing | Intermediate | Advanced,high,flow_and_trim,mid_length | paddle_support | flow,alternative | beginner | big_wave | competition | daily_driver | everyday | fish | forgiving_shortboard | good_wave | groveller | gun | hollow_wave | hybrid_shortboard | longboard | performance_daily_driver | performance_fish | performance_mid_length | performance_shortboard | performance_twin | point_break | powerful_wave | small_wave | small_wave_shortboard | softboard | step_up | traditional_fish | twin_pin | weak_wave,Mapped from canonical taxonomy mid_length.,"Pyzel's Mid Length Crisis can be a fresh feeling addition to your quiver, and is a great board to have for those of you who want to try a new approach to the same waves you’ve been surfing forever. Jon has been making many different versions of mid-lengths, mostly customs ordered for surfers in Japan, but lately he’s been building this one specific design for a bunch of his friends and a few select customers. The response has been great, so we’ve decided to embrace the movement and offer our version of the mid-length to everyone. Easy paddling, responsive and loose, the Mid Length Crisis has a semi-traditional, wide-point forward outline that is sleek and racey for fast, down-the-line drive, but full-bodied enough to provide added stability and glide in weaker, slower waves. It has a beautiful foil from nose to tail, with a rolled deck that leaves the meat in the middle of the board to help with paddling and nicely thinned out rails for sensitivity and bite. The rocker is a moderate, long, clean curve running from tip to tail without any radical changes or flip. It is designed for fast paddling and to easily generate speed, carry flow, and smooth turning at any speed. The bottom contours are a mild vee with double concave built into it (the old school term is “Spiral Vee”). This basically means that the board has no problem tipping from rail to rail, making smooth transitions t","It has a beautiful foil from nose to tail, with a rolled deck that leaves the meat in the middle of the board to help with paddling and nicely thinned out rails for sensitivity and bite. The rocker is a moderate, long, clean curve running from tip to tail without any radical changes or flip.",,"It has a beautiful foil from nose to tail, with a rolled deck that leaves the meat in the middle of the board to help with paddling and nicely thinned out rails for sensitivity and bite. The rocker is a moderate, long, clean curve running from tip to tail without any radical changes or flip.",,medium,high,proposed_for_owner_review,False,current primaryFamily=Mid Length; \bmid[ -]?length\b,,
Pyzel,Mini Ghost Round,7763,https://pyzelsurf.com.au/products/mini-ghost-round-electralite-eps,Hybrid Shortboard,All Round Daily Driver,hybrid_shortboard,daily_driver,Thruster | Five Fin,weak,,Progressing | Intermediate | Advanced,moderate_high,moderate,hybrid_shortboard | daily_driver | forgiving_shortboard,alternative | beginner | big_wave | competition | everyday | fish | flow | good_wave | groveller | gun | hollow_wave | longboard | mid_length | paddle_support | performance_daily_driver | performance_fish | performance_mid_length | performance_shortboard | performance_twin | point_break | powerful_wave | small_wave | small_wave_shortboard | softboard | step_up | traditional_fish | twin_pin | weak_wave,Mapped from canonical taxonomy hybrid.,"The Pyzel's Mini Ghost Round Electralite EPS came to be as a result of working with Koa Smith to build a rippable short, chunky, fun version of one of his favourites, the Ghost. Koa loves riding tiny boards for the smaller days on the North Shore, but we needed to pack more volume into them to make them functional and give them paddle power and stability. We shrunk Koa’s 5’9 Ghost down to a 5’5’’ and to give it more float we widened it up a touch, flattened out the deck and made the rails thicker and more boxy. We also added a modern beak nose to keep even more foam under the chest-area and up into the nose. The volume added is significant - a 5’10’’ Ghost XL is 28.80 liters, while a 5’7’’ Mini Ghost comes in at 28.70 liters! We made a few small changes to the rocker and it comes in either a round tail, or a wider bump squash to make the board very fun in smaller, weaker waves. Overall the best way to describe it is a sort of throwback 80’s looking board with all the added performance features of a modern design. It’s made for high performance ripping, but is also great for less skilled surfers due to the added volume and forgiving ride. Meant to be ridden 3-4 inches shorter, and around the same volume as your normal shortboard, the Mini Ghost will give your surfing a fresh feel and keep you happy in all kinds of conditions and types of waves. Now in Electralite EPS Constructio","We shrunk Koa’s 5’9 Ghost down to a 5’5’’ and to give it more float we widened it up a touch, flattened out the deck and made the rails thicker and more boxy. We made a few small changes to the rocker and it comes in either a round tail, or a wider bump squash to make the board very fun in smaller, weaker waves.",,round tail,,low,high,proposed_for_owner_review,False,current primaryFamily=Hybrid Shortboard; \bhybrid shortboard\b,,
Pyzel,Mini Ghost Squash,7764,https://pyzelsurf.com.au/products/minighostsquashxlelec,Performance Daily Driver,Performance Daily Driver,performance_daily_driver,daily_driver,Thruster | Five Fin,weak,,Intermediate | Advanced,moderate,high_everyday,performance_daily_driver | daily_driver | performance_shortboard,alternative | beginner | big_wave | competition | everyday | fish | flow | forgiving_shortboard | good_wave | groveller | gun | hollow_wave | hybrid_shortboard | longboard | mid_length | paddle_support | performance_fish | performance_mid_length | performance_twin | point_break | powerful_wave | small_wave | small_wave_shortboard | softboard | step_up | traditional_fish | twin_pin | weak_wave,Curated step-down Ghost-family classification.,"The Pyzel Mini Ghost Squash came to be as a result of working with Koa Smith to build a rippable short, chunky, fun version of one of his favourites, the Ghost. Koa loves riding tiny boards for the smaller days on the North Shore, but we needed to pack more volume into them to make them functional and give them paddle power and stability. We shrunk Koa’s 5’9 Ghost down to a 5’5’’ and to give it more float we widened it up a touch, flattened out the deck and made the rails thicker and boxier. We also added a modern beak nose to keep even more foam under the chest area and up into the nose. The volume added is significant - a 5’10’’ Ghost XL is 28.80 litres, while a 5’7’’ Mini Ghost comes in at 29.2 litres! We made a few small changes to the rocker and it comes in either a round tail or a wider bump squash to make the board very fun in smaller, weaker waves. Overall the best way to describe it is a sort of throwback 80’s looking board with all the added performance features of a modern design. It’s made for high-performance ripping but is also great for less skilled surfers due to the added volume and forgiving ride. Meant to be ridden 3-4 inches shorter, and around the same volume as your normal shortboard, the Mini Ghost will give your surfing a fresh feel and keep you happy in all kinds of conditions and types of waves.","We shrunk Koa’s 5’9 Ghost down to a 5’5’’ and to give it more float we widened it up a touch, flattened out the deck and made the rails thicker and boxier. We made a few small changes to the rocker and it comes in either a round tail or a wider bump squash to make the board very fun in smaller, weaker waves.",,round tail,,medium,high,proposed_for_owner_review,False,current primaryFamily=Performance Daily Driver; \bperformance daily driver\b,,
Pyzel,Next Step,7782,https://pyzelsurf.com.au/products/nextstep,Step Up,Reef Step Up,step_up,,Thruster,powerful,,Advanced | Expert,moderate,high_powerful_wave,step_up | powerful_wave | hollow_wave,alternative | beginner | big_wave | competition | daily_driver | everyday | fish | flow | forgiving_shortboard | good_wave | groveller | gun | hybrid_shortboard | longboard | mid_length | paddle_support | performance_daily_driver | performance_fish | performance_mid_length | performance_shortboard | performance_twin | point_break | small_wave | small_wave_shortboard | softboard | traditional_fish | twin_pin | weak_wave,Curated step-up classification.,"The Next Step is a great board to have if you like to surf bigger waves than your shorty can handle, just down the road or on your dream surf trip. It surfs loose, like a shortboard, but has the extra paddle-power and hold you need in solid surf. Proven worldwide by the worlds best surfers, at places like Pipeline, Mainland Mexico, Tahiti, Fiji and Western Australia. We recommend that you go anywhere from 2"" to 8"" up from your shortboard, and add at least 1/8"" of thickness (more as you go longer) to help get you in early.It has a lot of rocker for making step drops, a touch of extra thickness through the nose for paddle power, and refined rails to give you control where you need it most, in the barrel. This board is what you need if you want to go bigger.","We recommend that you go anywhere from 2"" to 8"" up from your shortboard, and add at least 1/8"" of thickness (more as you go longer) to help get you in early.It has a lot of rocker for making step drops, a touch of extra thickness through the nose for paddle power, and refined rails to give you control where you need it most, in the barrel.",refined rails,,,medium,high,proposed_for_owner_review,False,current primaryFamily=Step Up; \bstep[ -]?up\b; \bsolid surf\b,,
Pyzel,Padillac,7781,https://pyzelsurf.com.au/products/mini-padillac,Semi Gun,Travel Step Up,step_up,daily_driver,Thruster,moderate,,Advanced | Expert,moderate,high_powerful_wave,step_up | powerful_wave | hollow_wave,alternative | beginner | big_wave | competition | daily_driver | everyday | fish | flow | forgiving_shortboard | good_wave | groveller | gun | hybrid_shortboard | longboard | mid_length | paddle_support | performance_daily_driver | performance_fish | performance_mid_length | performance_shortboard | performance_twin | point_break | small_wave | small_wave_shortboard | softboard | traditional_fish | twin_pin | weak_wave,Curated big-wave board classification.,"The Mini Padillac is a great step-up for people who want a fast paddling and maneuverable board that is stable and easy to ride. It’s made to get you into waves easily and early, and still fit into a curvy, late drop. Some might even even use it as their everyday board. We took our proven Padillac, shrunk it down and then redesigned the front half to help it fit into waves that are less than gigantic. When we shrunk it down, the nose ended up feeling pretty wide and the nose rocker felt a bit flat, so we pulled in the nose width and added a bit more nose rocker. The back ½ of the board is the same, but the changes to the forward ½ allow the boards to fit into a curvier wave face and handle later drops with ease. The Mini Padillac still carries extra volume up under the chest area, but the thickness is hidden away by a nice rolled deck curve and thinned out rails for maximum responsiveness and speed. When you hold it under your arm a 2 ¾’ thick Mini Padillac feels like a 2 ⅜’ thick shortboard! The rocker is a long, continuous curve which helps it ride smooth and consistent without any surprises through big turns. The bottom contour is a gentle Vee with double concave running a light flat Vee through the fins and off the tail. This combo keeps the boards both loose and fast, while further providing stability and drive. The tail is a swallow, which adds a little extra squirt off y","When we shrunk it down, the nose ended up feeling pretty wide and the nose rocker felt a bit flat, so we pulled in the nose width and added a bit more nose rocker. The Mini Padillac still carries extra volume up under the chest area, but the thickness is hidden away by a nice rolled deck curve and thinned out rails for maximum responsiveness and speed.",,"The bottom contour is a gentle Vee with double concave running a light flat Vee through the fins and off the tail. The tail is a swallow, which adds a little extra squirt off your bottom turn and pivot to your top turns.",,medium,high,proposed_for_owner_review,True,\bstep[ -]?up\b; \bsemi[ -]?gun\b,,
Pyzel,Phantom,7787,https://pyzelsurf.com.au/products/phantom-electralite-eps,Performance Daily Driver,Performance Daily Driver,performance_daily_driver,daily_driver | performance_shortboard,Thruster,powerful,,Intermediate | Advanced | Expert,moderate,high_everyday,performance_daily_driver | daily_driver | performance_shortboard,alternative | beginner | big_wave | competition | everyday | fish | flow | forgiving_shortboard | good_wave | groveller | gun | hollow_wave | hybrid_shortboard | longboard | mid_length | paddle_support | performance_fish | performance_mid_length | performance_twin | point_break | powerful_wave | small_wave | small_wave_shortboard | softboard | step_up | traditional_fish | twin_pin | weak_wave,Manufacturer calls it a daily driver with a high-performance edge.,"Pyzel's The Phantom is the middle child in the Ghost Family, a step-down version of John John Florence's current favorite model (the Ghost) and designed to be your go-to board for everyday conditions. When we first brought out the Ghost we had no idea that its' unique design would come to be embraced by so many people in so many different types of waves. However, the feedback we kept hearing was that it was best in waves shoulder-high and up, so we looked at making a step-down board that would bring that same feel to the head-high and under days that make up most of our daily surf sessions. The Phantom is a Ghost squashed down, souped up, and with added volume, great for your everyday sessions in less than epic conditions. We left the same Ghost rocker but added more single concave to flatten it out through the center, helping to create speed and flow without taking away from the overall performance or feel of the original design. The added width in the tail and nose create a more parallel, fuller outline that helps keep speed up through slower sections and tight turns. The rails are full but not chunky, giving you more floatation and speed without taking away the sensitivity that we all love in our boards. Best in waist-high to overhead waves of all types the Phantom is your daily driver with a high performance edge. Ride it around your height, a touch wider and about the same","We left the same Ghost rocker but added more single concave to flatten it out through the center, helping to create speed and flow without taking away from the overall performance or feel of the original design. The rails are full but not chunky, giving you more floatation and speed without taking away the sensitivity that we all love in our boards.",,"The Phantom is a Ghost squashed down, souped up, and with added volume, great for your everyday sessions in less than epic conditions. We left the same Ghost rocker but added more single concave to flatten it out through the center, helping to create speed and flow without taking away from the overall performance or feel of the original design.",More forgiving than a true HPSB | Not as narrow or demanding as a comp board,high,high,proposed_for_owner_review,False,current primaryFamily=Performance Daily Driver; \bperformance daily driver\b,,
Pyzel,Phantom Round,7797,https://pyzelsurf.com.au/products/phantomround,Hybrid Shortboard,All Round Daily Driver,hybrid_shortboard,daily_driver,Thruster | Five Fin,powerful,,Progressing | Intermediate | Advanced,moderate_high,moderate,hybrid_shortboard | daily_driver | forgiving_shortboard,alternative | beginner | big_wave | competition | everyday | fish | flow | good_wave | groveller | gun | hollow_wave | longboard | mid_length | paddle_support | performance_daily_driver | performance_fish | performance_mid_length | performance_shortboard | performance_twin | point_break | powerful_wave | small_wave | small_wave_shortboard | softboard | step_up | traditional_fish | twin_pin | weak_wave,Mapped from canonical taxonomy daily_driver.,"The Phantom is a Step-down version of John John Florences current favourite model, the Ghost. Pyzel's Phantom Round is best in waist-high to slightly overhead waves of all types. It's your daily driver with a high-performance edge! When the Ghost was first released we had no idea that its unique design would come to be embraced by so many people in so many different types of waves. We kept hearing that it worked best in waves shoulder-high and up. Taking this feedback we made a step-down board that would bring that same feel to the head-high and under days that make up most of our daily surf sessions. The Phantom is a squashed down version of the Ghost, souped-up, with added volume, great for your everyday sessions in less than epic conditions. We left the same Ghost rocker but added more single concave to flatten it out through the center, which helps to create speed and flow without taking away from the overall performance or feel of the original design. We added width in the tail and nose to create a more parallel, fuller outline that helps you maintain speed through slower sections and tight turns. The rails are full but not chunky, giving you more floatation and speed without taking away the sensitivity that we all love in our boards.","We left the same Ghost rocker but added more single concave to flatten it out through the center, which helps to create speed and flow without taking away from the overall performance or feel of the original design. The rails are full but not chunky, giving you more floatation and speed without taking away the sensitivity that we all love in our boards.",,"The Phantom is a squashed down version of the Ghost, souped-up, with added volume, great for your everyday sessions in less than epic conditions. We added width in the tail and nose to create a more parallel, fuller outline that helps you maintain speed through slower sections and tight turns.",,medium,high,proposed_for_owner_review,False,current primaryFamily=Hybrid Shortboard; \bhybrid shortboard\b,,
